{
  "schemaVersion": 1,
  "id": "fixture-implemented-plan",
  "parkId": "thorpe-park",
  "authority": {
    "name": "Fixture Planning Authority",
    "officialPortal": "https://example.test/planning"
  },
  "reviewedAt": "2026-08-11",
  "documents": [
    {
      "id": "fixture-layout",
      "applicationReference": "APP-001",
      "applicationStatus": "implemented",
      "role": "approved-site-layout",
      "reuseStatus": "fixture-only",
      "derivedGeojson": "planning-authority.geojson",
      "worldEligible": true,
      "worldEligibilityBasis": "Test fixture explicitly represents the implemented fixture state."
    }
  ]
}
